Sheet: Proto 1
A1: Totals | D1: of:=SUM([.D4:.D100]) -> 9.21
A3: Item | B3: Quantity | C3: Item Cost | D3: Total Cost | E3: Link
A4: Relay | B4: 1 | C4: 2 | D4: of:=[.C4]*[.B4] -> 2
A5: Red LEDs | B5: 30 | C5: 0.05 | D5: of:=[.C5]*[.B5] -> 1.5
A6: Orange LEDs | B6: 15 | C6: 0.05 | D6: of:=[.C6]*[.B6] -> 0.75
A7: Blue LED | B7: 5 | C7: 0.1 | D7: of:=[.C7]*[.B7] -> 0.5
A8: ATTiny45 | B8: 1 | C8: 0.26 | D8: of:=[.C8]*[.B8] -> 0.26
A9: Reset Switch | B9: 1 | C9: 0.1 | D9: of:=[.C9]*[.B9] -> 0.1
A10: Pull Up Resistor | B10: 1 | C10: 0.1 | D10: of:=[.C10]*[.B10] -> 0.1
A11: N-MOS (For Relay) | B11: 1 | C11: 0.2 | D11: of:=[.C11]*[.B11] -> 0.2
A12: Bridge Diodes | B12: 4 | C12: 0.1 | D12: of:=[.C12]*[.B12] -> 0.4
A13: Opamp | B13: 1 | C13: 0.1 | D13: of:=[.C13]*[.B13] -> 0.1
A14: 200V Caps | B14: 1 | C14: 0.5 | D14: of:=[.C14]*[.B14] -> 0.5
A15: 10V Caps | B15: 5 | C15: 0.1 | D15: of:=[.C15]*[.B15] -> 0.5
A16: Resistor Divider High | B16: 1 | C16: 0.1 | D16: of:=[.C16]*[.B16] -> 0.1
A17: Resistor Divider Low | B17: 1 | C17: 0.1 | D17: of:=[.C17]*[.B17] -> 0.1
A18: Syrofoam Cooler | B18: 2 | C18: 1 | D18: of:=[.C18]*[.B18] -> 2
A19: Current Sense Resistor | B19: 1 | C19: 0.1 | D19: of:=[.C19]*[.B19] -> 0.1
A20: Breadboard (For Programming the ATTiny) | B20: 1 | C20: 5